,timestamp,source,log_message,target_label,complexity,clusters
1437,1/27/2025 18:42,ModernHR,Account with ID 9614 created by User610.,User Action,regex,
1440,3/25/2025 7:59,ModernHR,Disk cleanup completed successfully.,System Notification,regex,
1447,4/7/2025 3:35,BillingSystem,Detection of potential admin privilege abuse by user 2437,Security Alert,bert,
1448,11/23/2025 2:54,ModernCRM,Severe application issue found in main system component,Critical Error,bert,
1452,12/4/2025 14:17,ThirdPartyAPI,Alert: Admin privilege escalation for user 6856 detected,Security Alert,bert,
1453,9/11/2025 1:18,BillingSystem,Mail delivery error impacted email service,Critical Error,bert,
1456,11/14/2025 17:55,AnalyticsEngine,Disk cleanup completed successfully.,System Notification,regex,
1461,2/11/2025 15:27,AnalyticsEngine,Data export attempt exceeded authorized limits,Security Alert,bert,
1466,7/22/2025 18:11,AnalyticsEngine,"Server 4 has been compromised, potential security risk",Security Alert,bert,
1469,6/18/2025 23:52,ModernHR,Disk cleanup completed successfully.,System Notification,regex,
1470,9/7/2025 7:24,ModernHR,Detected a data export attempt with invalid permissions,Security Alert,bert,
1473,3/18/2025 5:25,ThirdPartyAPI,User 3834 made an unauthorized API request,Security Alert,bert,
1476,9/23/2025 14:43,AnalyticsEngine,Widespread configuration damage has been found,Critical Error,bert,
1477,3/27/2025 16:51,ModernCRM,Account Account1297 login was unsuccessful due to restrictions,Security Alert,bert,
1484,10/2/2025 4:14,AnalyticsEngine,Unusual access attempt from 192.168.183.132 logged,Security Alert,bert,
1485,5/5/2025 12:30,AnalyticsEngine,Critical system device issue: device ID Component52,Critical Error,bert,
1486,5/27/2025 21:49,ThirdPartyAPI,Boot sequence was aborted due to kernel failure,Critical Error,bert,
1487,11/10/2025 18:36,BillingSystem,User 5019 had multiple unsuccessful login attempts,Security Alert,bert,
1491,5/1/2025 22:27,ModernCRM,Invalid credentials used for account Account1056 login,Security Alert,bert,
1493,5/28/2025 7:58,BillingSystem,Unsuccessful login try on locked account Account9385,Security Alert,bert,
1503,2/7/2025 18:45,ModernHR,System component is not operating: component ID Component26,Critical Error,bert,
1505,6/15/2025 5:10,BillingSystem,API access request from user 8502 was rejected due to invalid credentials,Security Alert,bert,
1506,11/12/2025 13:12,AnalyticsEngine,Kernel error caused system to malfunction during initialization,Critical Error,bert,
1507,12/10/2025 8:35,ThirdPartyAPI,Privilege elevation detected for user 3965,Security Alert,bert,
1510,2/12/2025 5:11,ModernCRM,Account Account5979 login attempt was not successful,Security Alert,bert,
1511,7/3/2025 21:53,ModernHR,Error replicating data to shard 2,Error,bert,
1516,11/5/2025 12:56,ModernHR,Multiple disk malfunctions in RAID setup identified,Critical Error,bert,
1519,5/20/2025 8:58,BillingSystem,Anomalous traffic from 192.168.122.215 flagged for review,Security Alert,bert,
1524,11/30/2025 2:39,ThirdPartyAPI,System reboot initiated by user User278.,System Notification,regex,
1525,10/26/2025 7:10,ThirdPartyAPI,Multiple login failures were detected for user 5304,Security Alert,bert,
1529,9/2/2025 19:33,BillingSystem,Disk cleanup completed successfully.,System Notification,regex,
1531,6/23/2025 4:00,ModernCRM,Account with ID 9928 created by User354.,User Action,regex,
1532,4/8/2025 22:51,AnalyticsEngine,Account Account3011 blocked due to failed login,Security Alert,bert,
1533,12/11/2025 9:09,ModernHR,User 9214 did not have permission to access API,Security Alert,bert,
1539,5/5/2025 22:24,ModernHR,API access log shows unauthorized attempt by user 9193,Security Alert,bert,
1542,11/8/2025 20:19,BillingSystem,Disk cleanup completed successfully.,System Notification,regex,
1545,10/19/2025 0:00,BillingSystem,Several unsuccessful login tries found for user 7058,Security Alert,bert,
1554,3/2/2025 9:21,ModernCRM,Email system had a difficulty sending messages,Error,bert,
1556,2/9/2025 7:08,BillingSystem,Brute force login detected from IP 192.168.246.138 address,Security Alert,bert,
1557,3/10/2025 19:48,AnalyticsEngine,Account Account2597 login was unsuccessful due to restrictions,Security Alert,bert,
1558,8/16/2025 15:32,ThirdPartyAPI,Disk cleanup completed successfully.,System Notification,regex,
1559,6/11/2025 12:15,ThirdPartyAPI,Multiple hard drive failures detected in RAID configuration,Critical Error,bert,
1561,2/8/2025 16:53,AnalyticsEngine,System component failure occurred: component ID Component84,Critical Error,bert,
1562,8/18/2025 4:17,ThirdPartyAPI,System reboot initiated by user User648.,System Notification,regex,
1563,7/4/2025 14:51,ThirdPartyAPI,System component is not operating: component ID Component4,Critical Error,bert,
1565,11/9/2025 8:50,BillingSystem,Server 45 experienced an unanticipated restart during data reconciliation,Error,bert,
1567,5/11/2025 11:17,ThirdPartyAPI,Email system affected by delivery failure,Critical Error,bert,
1569,2/21/2025 21:16,ModernHR,Invalid input syntax found in module X,Error,bert,
1572,2/25/2025 16:53,ThirdPartyAPI,Unsanctioned data transfer request was received,Security Alert,bert,
1574,11/24/2025 1:27,ModernCRM,Detection of admin privilege misuse by user 8227,Security Alert,bert,
1581,8/9/2025 4:21,ModernHR,Warning: potential password cracking attempt from 192.168.190.64,Security Alert,bert,
1582,9/10/2025 9:27,BillingSystem,Email delivery failure resulted in service issue,Critical Error,bert,
1584,11/2/2025 2:37,AnalyticsEngine,Detection of multiple failed disks in RAID setup,Critical Error,bert,
1586,5/2/2025 8:32,ThirdPartyAPI,Disk cleanup completed successfully.,System Notification,regex,
1590,3/7/2025 21:13,AnalyticsEngine,Account with ID 2580 created by User185.,User Action,regex,
1595,3/19/2025 2:10,BillingSystem,"Warning: unusual patterns detected on server 5, security check advised",Security Alert,bert,
1596,11/23/2025 3:32,ModernCRM,System component is not functioning: component ID Component23,Critical Error,bert,
1599,9/5/2025 16:25,ThirdPartyAPI,Service health check failed because of an invalid SSL certificate.,Error,bert,
1604,8/24/2025 12:40,ModernHR,Security warning: unusual network activity on server 41,Security Alert,bert,
1608,5/25/2025 14:09,ModernCRM,Account Account5342 access denied due to login failure,Security Alert,bert,
1609,10/6/2025 8:27,ThirdPartyAPI,Security alert: suspicious activity from 192.168.140.76,Security Alert,bert,
1611,6/14/2025 13:31,AnalyticsEngine,Possible hacking attempt identified from IP 192.168.177.239,Security Alert,bert,
1617,7/28/2025 14:26,ModernHR,Kernel malfunction caused boot process to terminate,Critical Error,bert,
1618,5/20/2025 20:46,ModernCRM,Operating system failed to boot properly,Critical Error,bert,
1620,10/12/2025 19:59,ThirdPartyAPI,Disk cleanup completed successfully.,System Notification,regex,
1622,7/8/2025 0:14,AnalyticsEngine,Critical system part failure: part ID Component72,Critical Error,bert,
1624,12/14/2025 5:14,AnalyticsEngine,System reboot initiated by user User268.,System Notification,regex,
1625,3/26/2025 9:08,ModernHR,Critical system unit failure: unit ID Component41,Critical Error,bert,
1626,3/10/2025 8:08,BillingSystem,Alert: Admin privilege escalation for user 5721 detected,Security Alert,bert,
1627,4/16/2025 7:04,AnalyticsEngine,Multiple login failures were detected for user 6607,Security Alert,bert,
1628,2/20/2025 20:44,BillingSystem,Shard 16 synchronization task failed,Error,bert,
1638,2/10/2025 11:18,BillingSystem,SSL certificate issue caused service health check to fail.,Error,bert,
1641,8/30/2025 7:28,ModernCRM,API access control system blocked user 6559,Security Alert,bert,
1644,6/20/2025 19:54,AnalyticsEngine,Module X encountered an issue with improperly formatted input,Error,bert,
1655,12/2/2025 1:06,AnalyticsEngine,Service health check did not pass due to an invalid SSL certificate configuration.,Error,bert,
1659,5/22/2025 17:58,ThirdPartyAPI,Server 3 faced an unanticipated shutdown during data upload,Error,bert,
1663,10/27/2025 22:04,AnalyticsEngine,System reboot initiated by user User315.,System Notification,regex,
1665,5/24/2025 0:51,ThirdPartyAPI,Critical system module error: module ID Component31,Critical Error,bert,
1667,4/3/2025 14:00,AnalyticsEngine,Multiple rejected login attempts found for user 6397,Security Alert,bert,
1669,11/21/2025 14:10,ModernCRM,Warning: IP 192.168.65.57 may be compromised,Security Alert,bert,
1674,4/8/2025 7:20,ModernHR,Error replicating data to shard 1,Error,bert,
1677,10/15/2025 6:10,BillingSystem,Account Account6722 access denied due to login failure,Security Alert,bert,
1682,12/24/2025 11:24,ModernHR,Suspicious login activity detected from 192.168.240.157,Security Alert,bert,
1687,11/28/2025 9:47,BillingSystem,Account with ID 1724 created by User232.,User Action,regex,
1688,8/4/2025 12:08,ModernHR,Disk cleanup completed successfully.,System Notification,regex,
1690,12/6/2025 2:36,BillingSystem,Server 7 restarted without warning during data migration,Error,bert,
1691,1/16/2025 6:41,ModernCRM,System crash occurred during operating system startup,Critical Error,bert,
1693,3/4/2025 11:49,AnalyticsEngine,Multiple failed login attempts were reported for user 5355,Security Alert,bert,
1697,12/26/2025 9:37,ThirdPartyAPI,Security alert: unauthorized API access attempt by user 8462,Security Alert,bert,
1701,2/2/2025 3:45,BillingSystem,Failed to login to restricted account Account4990,Security Alert,bert,
1702,3/18/2025 9:06,AnalyticsEngine,Critical system part failure: part ID Component28,Critical Error,bert,
1703,6/10/2025 6:11,ModernHR,Server 19 was rebooted without notice during data verification,Error,bert,
1705,3/28/2025 19:20,ModernHR,Essential system part malfunction: part ID Component54,Critical Error,bert,
1706,10/9/2025 5:40,ModernHR,API access audit trail shows unauthorized entry for user 5887,Security Alert,bert,
1708,8/3/2025 15:09,ModernCRM,Potential security breach detected on server 48,Security Alert,bert,
1711,8/18/2025 16:13,ModernHR,Several login attempts by user 6641 were unsuccessful,Security Alert,bert,
1721,2/25/2025 0:13,BillingSystem,Anomalous traffic from 192.168.210.159 flagged for review,Security Alert,bert,
1723,7/9/2025 13:42,ModernHR,Denied access attempt on restricted account Account4130,Security Alert,bert,
1727,10/25/2025 6:07,AnalyticsEngine,Potential vulnerability exploit detected from 192.168.96.60,Security Alert,bert,
1730,1/6/2025 16:48,BillingSystem,"Unidentified activity on server 37, possible security issue",Security Alert,bert,
1736,4/1/2025 13:39,ModernCRM,Invalid API access request detected for user 4200,Security Alert,bert,
1740,10/7/2025 8:13,ModernHR,Unauthenticated data transfer attempt was detected,Security Alert,bert,
1743,1/6/2025 20:17,ModernHR,Failed to replicate data for shard 13,Error,bert,
1745,3/4/2025 3:41,ThirdPartyAPI,Several unsuccessful login tries found for user 9353,Security Alert,bert,
1747,5/1/2025 10:02,ModernHR,Admin rights elevated for user 6519,Security Alert,bert,
1755,9/10/2025 5:44,BillingSystem,Disk cleanup completed successfully.,System Notification,regex,
1757,4/9/2025 9:33,AnalyticsEngine,Potential security vulnerability found on server 6,Security Alert,bert,
1758,4/23/2025 11:05,AnalyticsEngine,Invalid API access request detected for user 7316,Security Alert,bert,
1759,12/29/2025 20:33,ModernCRM,Unauthorised access attempt from 192.168.99.79 detected,Security Alert,bert,
1765,10/2/2025 6:14,ThirdPartyAPI,Critical system module failure: module ID Component66,Critical Error,bert,
1767,9/4/2025 10:56,AnalyticsEngine,API access log shows unauthorized attempt by user 1753,Security Alert,bert,
1768,12/20/2025 5:19,ModernHR,Multiple failed login tries occurred for user 9217,Security Alert,bert,
1769,8/9/2025 2:20,ThirdPartyAPI,Terminal system failure encountered in crucial module,Critical Error,bert,
1770,10/7/2025 23:19,AnalyticsEngine,Disk cleanup completed successfully.,System Notification,regex,
1772,8/10/2025 18:51,ModernHR,Warning: Potential admin privilege escalation for user 5706,Security Alert,bert,
1774,7/22/2025 7:57,AnalyticsEngine,Failed to replicate data for shard 18,Error,bert,
1776,2/21/2025 11:56,ModernHR,System reboot initiated by user User155.,System Notification,regex,
1780,5/29/2025 10:45,ThirdPartyAPI,Login to secured account Account5069 was not possible,Security Alert,bert,
1781,2/25/2025 22:06,ThirdPartyAPI,User 4288 made multiple incorrect login attempts,Security Alert,bert,
1783,5/18/2025 2:23,BillingSystem,"Server 45 shows signs of unauthorized access, security risk present",Security Alert,bert,
1787,5/7/2025 17:02,ModernCRM,Disk cleanup completed successfully.,System Notification,regex,
1788,7/10/2025 21:38,BillingSystem,Potential DDoS attack from 192.168.242.180 detected,Security Alert,bert,
1790,5/12/2025 10:59,ModernHR,Admin privilege elevation warning for user 8383,Security Alert,bert,
1799,2/27/2025 22:37,ThirdPartyAPI,"Server 32 has been compromised, potential security risk",Security Alert,bert,
1801,1/28/2025 17:23,BillingSystem,Account with ID 3788 created by User123.,User Action,regex,
1802,7/21/2025 4:13,ThirdPartyAPI,Secured account Account8925 had unsuccessful login attempt,Security Alert,bert,
1803,8/22/2025 6:30,AnalyticsEngine,System reboot initiated by user User204.,System Notification,regex,
1804,8/26/2025 21:06,ModernHR,System reboot initiated by user User899.,System Notification,regex,
1807,7/5/2025 16:58,ModernHR,System failed to boot due to kernel panic issue,Critical Error,bert,
1814,5/16/2025 6:33,AnalyticsEngine,Account with ID 9807 created by User944.,User Action,regex,
1816,7/5/2025 12:07,ModernHR,Vital system component is down: component ID Component83,Critical Error,bert,
1818,5/16/2025 9:36,AnalyticsEngine,Unauthorized user 3051 tried to access restricted API,Security Alert,bert,
1820,10/2/2025 13:12,ThirdPartyAPI,Server 34 encountered an unforeseen restart during data processing,Error,bert,
1821,10/1/2025 1:54,BillingSystem,Account with ID 5103 created by User721.,User Action,regex,
1833,10/10/2025 14:05,BillingSystem,Disk cleanup completed successfully.,System Notification,regex,
1838,7/7/2025 20:36,BillingSystem,Systemic configuration inconsistencies detected,Critical Error,bert,
1844,6/10/2025 8:39,ThirdPartyAPI,"Alert: server 9 experienced unusual login attempts, security risk",Security Alert,bert,
1846,6/19/2025 7:44,ModernHR,Attempt to access account Account1376 was not authorized,Security Alert,bert,
1852,1/26/2025 12:34,AnalyticsEngine,System reboot initiated by user User223.,System Notification,regex,
1854,7/5/2025 13:05,AnalyticsEngine,Server 32 had an unexpected interruption during data synchronization,Error,bert,
1855,4/11/2025 18:50,BillingSystem,Key system element crashed: element ID Component29,Critical Error,bert,
1858,7/29/2025 7:57,ModernCRM,IP 192.168.100.253 flagged for potential cyber threat,Security Alert,bert,
1859,5/20/2025 23:34,BillingSystem,Security alert: unauthorized API access attempt by user 9802,Security Alert,bert,
1860,6/26/2025 1:08,BillingSystem,Email provider experienced a mail delivery issue,Error,bert,
1865,5/11/2025 10:58,AnalyticsEngine,System reboot initiated by user User932.,System Notification,regex,
1866,6/29/2025 10:37,ThirdPartyAPI,User 3692 account had multiple failed login tries,Security Alert,bert,
1867,10/6/2025 11:04,ModernCRM,Email service had a sending malfunction,Error,bert,
1868,10/8/2025 3:25,BillingSystem,Unfixable problem discovered in essential application module,Critical Error,bert,
1870,4/14/2025 6:53,AnalyticsEngine,Server 30 experienced an unanticipated restart during data reconciliation,Error,bert,
1873,8/25/2025 12:08,ModernHR,Unauthorized data export request was intercepted,Security Alert,bert,
1876,10/9/2025 8:30,BillingSystem,System configuration errors have been detected,Critical Error,bert,
1878,5/27/2025 22:11,BillingSystem,Disk cleanup completed successfully.,System Notification,regex,
1882,11/10/2025 1:24,AnalyticsEngine,Shard 4 replication task ended in failure,Error,bert,
1890,3/27/2025 7:44,BillingSystem,Multiple failed login attempts were reported for user 3550,Security Alert,bert,
1893,6/4/2025 14:57,ThirdPartyAPI,"Server 30 experienced unusual traffic, potential vulnerability",Security Alert,bert,
1898,8/27/2025 13:31,BillingSystem,Service health check was unsuccessful due to problems with the SSL certificate.,Error,bert,
1899,9/5/2025 10:13,ModernHR,"Server 13 shows signs of unauthorized access, security risk present",Security Alert,bert,
1901,9/22/2025 2:52,ThirdPartyAPI,Email service experienced a mail sending issue,Error,bert,
1903,3/15/2025 20:52,AnalyticsEngine,Unauthorized admin privilege escalation by user 8440,Security Alert,bert,
1906,5/27/2025 19:34,ThirdPartyAPI,User 7662 did not have permission to access API,Security Alert,bert,
1908,10/2/2025 18:01,ThirdPartyAPI,Invalid SSL certificate caused the service health check to be unsuccessful.,Error,bert,
1911,4/29/2025 21:34,AnalyticsEngine,Critical system part failure: part ID Component16,Critical Error,bert,
1912,6/17/2025 13:45,AnalyticsEngine,User 2185 has gained unauthorized admin access,Security Alert,bert,
1917,6/21/2025 10:22,AnalyticsEngine,User 4523 attempted to access API without proper authorization,Security Alert,bert,
1919,3/17/2025 18:15,BillingSystem,Alert: Admin privilege escalation for user 9724 detected,Security Alert,bert,
1925,4/30/2025 10:19,BillingSystem,Unauthorized login attempt on protected account Account2527,Security Alert,bert,
1930,3/27/2025 11:58,BillingSystem,Data replication issue on shard 13,Error,bert,
1932,6/27/2025 2:39,BillingSystem,User 2750 had multiple login attempts rejected,Security Alert,bert,
1936,12/2/2025 20:50,BillingSystem,Module X input processing failed due to invalid format,Error,bert,
1937,12/3/2025 5:57,ModernCRM,User 4300 failed to provide valid API access credentials,Security Alert,bert,
1940,1/2/2025 16:37,AnalyticsEngine,Terminal failure detected in crucial application section,Critical Error,bert,
1941,4/29/2025 4:28,BillingSystem,User 1988 has gained unauthorized admin access,Security Alert,bert,
1942,8/20/2025 17:47,ThirdPartyAPI,Account with ID 6874 created by User524.,User Action,regex,
1943,7/12/2025 2:52,ThirdPartyAPI,Systemic configuration issue has been detected,Critical Error,bert,
1944,1/14/2025 12:32,BillingSystem,Data replication for shard 8 encountered an issue,Error,bert,
1947,8/8/2025 15:03,ModernHR,Multiple failed login tries occurred for user 9361,Security Alert,bert,
1953,7/3/2025 15:56,ThirdPartyAPI,Restricted account Account3222 experienced failed login,Security Alert,bert,
1956,9/26/2025 19:32,ThirdPartyAPI,System reboot initiated by user User264.,System Notification,regex,
1957,12/27/2025 20:39,BillingSystem,Fatal issue encountered in central system module,Critical Error,bert,
1959,2/8/2025 1:48,ThirdPartyAPI,Data replication issue on shard 15,Error,bert,
1960,5/10/2025 16:30,ModernHR,Account with ID 2155 created by User809.,User Action,regex,
1966,6/5/2025 8:40,BillingSystem,IP 192.168.11.74 identified as potential attack source,Security Alert,bert,
1967,11/23/2025 5:35,ThirdPartyAPI,System component has stopped working: component ID Component41,Critical Error,bert,
1969,2/16/2025 7:50,ModernCRM,Account with ID 9829 created by User329.,User Action,regex,
1972,3/12/2025 3:48,ThirdPartyAPI,Delivery issue with email service caused outage,Critical Error,bert,
1973,1/18/2025 18:52,ModernHR,Detected a data export attempt without authorization,Security Alert,bert,
1975,4/21/2025 18:15,ThirdPartyAPI,User 4489 experienced repeated login failures,Security Alert,bert,
1977,2/28/2025 11:26,AnalyticsEngine,Invalid data encountered during execution of module X,Error,bert,
1979,9/28/2025 14:51,BillingSystem,Detected an unauthorized attempt to transfer data,Security Alert,bert,
1980,8/19/2025 19:15,ModernCRM,Severe malfunction identified in primary software module,Critical Error,bert,
1982,4/11/2025 8:53,ModernHR,Account with ID 6237 created by User607.,User Action,regex,
1985,12/29/2025 14:05,ModernCRM,System crash happened during startup process,Critical Error,bert,
1986,3/1/2025 21:11,ModernHR,Account with ID 6616 created by User170.,User Action,regex,
1987,9/26/2025 7:53,AnalyticsEngine,Unauthorized user 8557 tried to access restricted API,Security Alert,bert,
1988,11/21/2025 5:14,BillingSystem,System component has failed: component ID Component95,Critical Error,bert,
1996,10/25/2025 8:13,AnalyticsEngine,UnAuthorized admin access granted to user 8267,Security Alert,bert,
1997,7/23/2025 3:26,ThirdPartyAPI,User 3618 attempted to access API without proper authorization,Security Alert,bert,
2003,6/23/2025 17:54,ModernCRM,System reboot initiated by user User517.,System Notification,regex,
2005,12/2/2025 2:29,BillingSystem,Disk cleanup completed successfully.,System Notification,regex,
2008,11/4/2025 16:19,ModernHR,Shard 18 replication task ended in failure,Error,bert,
2009,4/19/2025 1:34,ThirdPartyAPI,Potential security vulnerability found on server 29,Security Alert,bert,
2014,12/25/2025 4:33,AnalyticsEngine,System reboot initiated by user User293.,System Notification,regex,
2016,3/27/2025 14:46,BillingSystem,Warning: Potential admin privilege escalation for user 1559,Security Alert,bert,
2017,5/25/2025 7:13,ModernCRM,"Security issue detected on server 43, investigation required",Security Alert,bert,
2025,3/28/2025 14:41,BillingSystem,Account Account2345 experienced unauthorized login attempt,Security Alert,bert,
2029,6/7/2025 13:28,AnalyticsEngine,System component has failed: component ID Component94,Critical Error,bert,
2031,3/28/2025 4:21,BillingSystem,Failure of critical system component: component ID Component92,Critical Error,bert,
2033,8/9/2025 20:25,ThirdPartyAPI,System component failure occurred: component ID Component78,Critical Error,bert,
2034,11/25/2025 12:27,ModernCRM,Server 43 crashed unexpectedly while syncing data,Error,bert,
2038,3/10/2025 17:53,ThirdPartyAPI,Account Account4999 experienced unauthorized login attempt,Security Alert,bert,
2042,3/2/2025 4:44,ModernHR,UnAuthorized admin access granted to user 5633,Security Alert,bert,
2043,9/12/2025 20:20,ThirdPartyAPI,System reboot initiated by user User262.,System Notification,regex,
2046,3/7/2025 1:57,ThirdPartyAPI,API access log shows unauthorized attempt by user 5643,Security Alert,bert,
2049,10/1/2025 22:07,AnalyticsEngine,Email server experienced a delivery problem,Error,bert,
2052,10/14/2025 13:13,ThirdPartyAPI,System configuration has been severely damaged,Critical Error,bert,
2054,5/16/2025 8:58,ModernCRM,Module X reported an invalid input format exception,Error,bert,
2055,9/11/2025 22:47,ModernCRM,Unauthorized login attempt on protected account Account5486,Security Alert,bert,
2059,6/23/2025 12:19,ModernHR,User 1809 has escalated admin privileges without authorization,Security Alert,bert,
2061,7/11/2025 20:44,ModernHR,Account with ID 1688 created by User619.,User Action,regex,
2062,6/7/2025 1:22,AnalyticsEngine,"Server 11 experienced potential security incident, review required",Security Alert,bert,
2065,1/17/2025 5:12,ModernHR,Detection of admin privilege misuse by user 5506,Security Alert,bert,
2068,1/9/2025 16:07,AnalyticsEngine,Unanticipated server 3 restart happened during data exchange,Error,bert,
2070,5/29/2025 9:07,ModernHR,"Server 20 has been flagged for suspicious activity, security review",Security Alert,bert,
2074,9/13/2025 8:43,ModernCRM,System reboot initiated by user User937.,System Notification,regex,
2076,7/9/2025 4:05,ModernHR,Shard 4 data synchronization failed,Error,bert,
2077,11/10/2025 12:50,AnalyticsEngine,Server 2 experienced an unplanned restart during data replication,Error,bert,
2079,6/5/2025 5:47,AnalyticsEngine,Disk cleanup completed successfully.,System Notification,regex,
2082,1/20/2025 0:31,ThirdPartyAPI,Disk cleanup completed successfully.,System Notification,regex,
2085,12/23/2025 13:44,ModernHR,Multiple failed login tries occurred for user 1792,Security Alert,bert,
2086,2/12/2025 11:37,ThirdPartyAPI,Critical system device issue: device ID Component20,Critical Error,bert,
2090,6/18/2025 22:26,ModernCRM,System-wide configuration failure has occurred,Critical Error,bert,
2091,5/16/2025 17:48,BillingSystem,User 7977 made an unauthorized API request,Security Alert,bert,
2094,3/30/2025 0:37,ModernCRM,Failed to login to restricted account Account6973,Security Alert,bert,
2095,5/3/2025 8:59,AnalyticsEngine,Critical system element is down: element ID Component77,Critical Error,bert,
2101,1/5/2025 2:24,BillingSystem,Security alert: suspicious activity on server 31,Security Alert,bert,
2102,8/10/2025 4:15,ModernCRM,"Unidentified activity on server 43, possible security issue",Security Alert,bert,
2103,8/17/2025 3:05,ModernCRM,Multiple invalid login attempts were made for user 1087,Security Alert,bert,
2105,5/23/2025 19:17,ModernCRM,Unauthorized try to login on restricted account Account9275,Security Alert,bert,
2109,7/14/2025 7:21,ModernHR,Irreparable failure detected in fundamental application,Critical Error,bert,
2112,3/4/2025 3:55,AnalyticsEngine,"Server 37 experienced unusual traffic, potential vulnerability",Security Alert,bert,
2117,1/26/2025 15:27,ModernCRM,Multiple incorrect login attempts were made by user 5215,Security Alert,bert,
2119,8/12/2025 8:39,AnalyticsEngine,Account with ID 7238 created by User520.,User Action,regex,
2120,5/28/2025 23:08,BillingSystem,Data replication task for shard 4 did not complete,Error,bert,
2121,9/6/2025 0:33,AnalyticsEngine,Invalid API access request detected for user 8796,Security Alert,bert,
2124,5/31/2025 23:29,AnalyticsEngine,System component failure occurred: component ID Component54,Critical Error,bert,
2125,10/7/2025 9:10,ModernHR,Admin privilege escalation alert for user 2655,Security Alert,bert,
